{
  "version": "draft-0.1",
  "request_id": "11111111-1111-4111-8111-111111111111",
  "trace_id": "22222222-2222-4222-8222-222222222222",
  "provider": "chrono_task",
  "operation": "task.postpone",
  "proposal_id": "33333333-3333-4333-8333-333333333333",
  "revision": 2,
  "status": "ready",
  "reason_code": null,
  "execution_expires_at": "2026-09-19T09:05:00Z",
  "status_available_until": "2026-10-19T09:05:00Z",
  "receipt_detail_available_until": null,
  "idempotency_available_until": null,
  "question": "資料作成の期限を2026年9月22日に延期しますか？",
  "candidates": null,
  "target": {
    "target_ref": "st1_AAAAAAAAAAAAAAAAAAAAAAAAAAAAAAAAAAAAAAAAAAA",
    "target_version": "sv1_k1_MMMMMMMMMMMMMMMMMMMMMMMMMMMMMMMMMMMMMMMMMMM",
    "kind": "task",
    "display": {
      "title": "資料作成"
    }
  },
  "before": {
    "kind": "task",
    "title": "資料作成",
    "description": null,
    "status": "todo",
    "priority": "normal",
    "deadline": {
      "precision": "date",
      "due_on": "2026-09-20",
      "due_at": null,
      "time_zone": "Asia/Tokyo"
    }
  },
  "after": {
    "kind": "task",
    "title": "資料作成",
    "description": null,
    "status": "todo",
    "priority": "normal",
    "deadline": {
      "precision": "date",
      "due_on": "2026-09-22",
      "due_at": null,
      "time_zone": "Asia/Tokyo"
    }
  },
  "changed_fields": [
    "deadline"
  ],
  "relationship_fingerprint": "sr1_k1_UUUUUUUUUUUUUUUUUUUUUUUUUUUUUUUUUUUUUUUUUUU",
  "planned_related_effects": {
    "type": "none"
  },
  "content_digest": "da7f9279a96867259d77e87a6d2f9f5429bfa134e6c1796e99b4552e5bc0db8a",
  "receipt": null,
  "refresh_scope": null
}
