{
  "version": "draft-0.1",
  "request_id": "11111111-1111-4111-8111-111111111111",
  "trace_id": "22222222-2222-4222-8222-222222222222",
  "provider": "chrono_flow",
  "operation": "event.delete",
  "proposal_id": "33333333-3333-4333-8333-333333333333",
  "revision": 1,
  "status": "needs_target",
  "reason_code": null,
  "execution_expires_at": "2026-09-19T09:05:00Z",
  "status_available_until": "2026-10-19T09:05:00Z",
  "receipt_detail_available_until": null,
  "idempotency_available_until": null,
  "question": "対象の予定を選んでください。",
  "candidates": {
    "truncated": false,
    "items": [
      {
        "candidate_ref": "sc1_EEEEEEEEEEEEEEEEEEEEEEEEEEEEEEEEEEEEEEEEEEE",
        "kind": "event",
        "display": {
          "title": "定例会議",
          "start_at": "2026-09-22T10:00:00+09:00",
          "end_at": "2026-09-22T11:00:00+09:00",
          "all_day": false
        },
        "target_version": "sv1_k1_MMMMMMMMMMMMMMMMMMMMMMMMMMMMMMMMMMMMMMMMMMM"
      },
      {
        "candidate_ref": "sc1_IIIIIIIIIIIIIIIIIIIIIIIIIIIIIIIIIIIIIIIIIII",
        "kind": "event",
        "display": {
          "title": "定例会議",
          "start_at": "2026-09-23T15:00:00+09:00",
          "end_at": "2026-09-23T16:00:00+09:00",
          "all_day": false
        },
        "target_version": "sv1_k1_QQQQQQQQQQQQQQQQQQQQQQQQQQQQQQQQQQQQQQQQQQQ"
      }
    ]
  },
  "target": null,
  "before": null,
  "after": null,
  "changed_fields": [],
  "relationship_fingerprint": null,
  "planned_related_effects": null,
  "content_digest": null,
  "receipt": null,
  "refresh_scope": null
}
